{
  "$schema": "https://json-schema.org/draft/2020-12/schema",
  "$id": "https://worldspec.dev/schemas/0.1/h1-locomotion-transition-profile.schema.json",
  "title": "WorldSpec H1 Move-to-Zero Transition Calibration Profile 0.1",
  "type": "object",
  "required": [
    "id",
    "profileVersion",
    "status",
    "stage",
    "baseTrainingProfileDigest",
    "runtime",
    "warmStart",
    "trainingOverrides",
    "environment",
    "qualityGates",
    "artifactPolicy",
    "evidenceStatus"
  ],
  "properties": {
    "id": {
      "$ref": "common.schema.json#/$defs/id"
    },
    "profileVersion": {
      "const": "0.1.0"
    },
    "status": {
      "const": "research"
    },
    "stage": {
      "const": "loaded_track_settle_transition"
    },
    "baseTrainingProfileDigest": {
      "const": "sha256:6c2002f7fedaae1739416c96e7698b389d8ddc7bedc7386921e141964128eec6"
    },
    "runtime": {
      "type": "object",
      "required": [
        "containerImage",
        "containerDigest",
        "packageLockDigest",
        "ccdIterations"
      ],
      "properties": {
        "containerImage": {
          "type": "string",
          "pattern": "^\\S+@sha256:[0-9a-f]{64}$"
        },
        "containerDigest": {
          "$ref": "common.schema.json#/$defs/digest"
        },
        "packageLockDigest": {
          "const": "sha256:7cc88f20b2c608d6fe673f3b994b879db69d75361206bf25f949d7acc5ed3a41"
        },
        "ccdIterations": {
          "const": 50
        }
      },
      "additionalProperties": false
    },
    "warmStart": {
      "const": {
        "sourceStage": "loaded-track-settle-v1-failed",
        "sourceReportDigest": "sha256:961ab5fa5c5f70482f46c8751496f3806f2377654d75d5bba4e6a9d7491a1e39",
        "checkpointDigest": "sha256:86d8e0de7c900fdbbf945cca1160518f4e27bf7735f40323de7ffadbf07d2c6a",
        "checkpointSizeBytes": 8821958,
        "distribution": "internal_only",
        "restore": {
          "normalizer": true,
          "policy": true,
          "value": true
        },
        "optimizerState": "reset"
      }
    },
    "trainingOverrides": {
      "const": {
        "numTimesteps": 16777216,
        "numEnvs": 4096,
        "numEvals": 8,
        "episodeLength": 1000,
        "unrollLength": 20,
        "numMinibatches": 16,
        "numUpdatesPerBatch": 4,
        "batchSize": 256
      }
    },
    "environment": {
      "const": {
        "commandDistribution": {
          "linearVelocityX": [
            0.0,
            0.6
          ],
          "linearVelocityY": [
            -0.1,
            0.1
          ],
          "angularVelocityYaw": [
            -0.25,
            0.25
          ],
          "zeroCommandProbability": 0.2
        },
        "transitionCurriculum": {
          "mode": "move_then_zero",
          "transitionCycleProbability": 0.75,
          "moveSteps": 150,
          "settleSteps": 50,
          "motionCommandDistribution": {
            "linearVelocityX": [
              0.4,
              0.6
            ],
            "linearVelocityY": [
              -0.05,
              0.05
            ],
            "angularVelocityYaw": [
              -0.1,
              0.1
            ]
          }
        },
        "termination": {
          "minimumBaseHeight": 0.5,
          "minimumUprightCosine": 0.25,
          "jointLimitToleranceRadians": 0.02
        },
        "reward": {
          "survival": 3.0,
          "trackingLinear": 6.0,
          "trackingYaw": 2.0,
          "upright": 3.0,
          "baseHeight": 2.0,
          "pose": 0.5,
          "verticalVelocityCost": 1.0,
          "angularVelocityXYCost": 0.5,
          "torqueCost": 0.000002,
          "actionRateCost": 0.03,
          "settleLinear": 8.0,
          "settleYaw": 3.0,
          "settleActionRateScale": 0.25
        },
        "targets": {
          "baseHeight": 0.98
        },
        "sigmas": {
          "tracking": 0.2,
          "upright": 0.05,
          "baseHeight": 0.02,
          "pose": 0.2,
          "settleTracking": 0.05
        },
        "commandResampleSteps": 200
      }
    },
    "qualityGates": {
      "const": {
        "minimumFinalMeanEpisodeLength": 900.0,
        "nominalDurationSeconds": 4.0,
        "moveDurationSeconds": 3.0,
        "settleWindowSeconds": 1.0,
        "requiredConsecutivePasses": 5,
        "minimumForwardDisplacement": 1.0,
        "maximumForwardDisplacement": 2.2,
        "maximumLateralDrift": 0.2,
        "maximumTrackingRmse": 0.25,
        "minimumBaseHeight": 0.8,
        "minimumUprightCosine": 0.8,
        "maximumSettleLinearSpeed": 0.2,
        "maximumSettleAngularSpeed": 0.4,
        "maximumStandPlanarDrift": 0.2,
        "maximumNonFiniteSamples": 0
      }
    },
    "artifactPolicy": {
      "const": {
        "checkpoint": "research_only",
        "distribution": "internal_only"
      }
    },
    "evidenceStatus": {
      "const": "derived"
    }
  },
  "additionalProperties": false
}
